{
  "schema": "assetsstudio_actor_slot_profile_v2",
  "id": "actor_core_chibi3_v9b_tpose_slots_v1",
  "label": "Chibi3 v9b experimental T-Pose attachment proxy",
  "revision": 1,
  "status": "experimental_proxy",
  "actor_asset_id": "actor_core_chibi3_source_v9b_seed20260830",
  "style_profile_id": "qstyle_anime_western_fantasy_chibi3_no_face_v1",
  "actor_model": {
    "path": "milestones/actor_core/chibi3_standard_v1_source_review_20260831/candidates/v9b_balanced/chibi3_v9b_balanced.glb",
    "sha256": "74f8787c7b044b9aca86bc9f80f28e1f34c809bb39907b9e26675832e9505e45",
    "role": "tpose_fitting_proxy"
  },
  "coordinate_contract": {
    "unit": "meter",
    "up": "+Z",
    "front": "-Y",
    "actor_left": "+X",
    "ground_z": 0.0,
    "normalization": "actor_height",
    "rig_state": "unbound_tpose"
  },
  "measurements": {
    "actor_bounds_m": {
      "min": [
        -0.872673,
        -0.303144,
        0.0
      ],
      "max": [
        0.865764,
        0.311234,
        1.988019
      ]
    },
    "head_bounds_m": {
      "min": [
        -0.303252,
        -0.303144,
        1.333694
      ],
      "max": [
        0.295571,
        0.311234,
        1.988019
      ]
    },
    "actor_height_m": 1.988019,
    "total_heads": 3.038095,
    "source": "milestones/actor_core/chibi3_standard_v1_source_review_20260831/candidates/v9b_balanced/validation/head_roundness_front.json"
  },
  "slots": [
    {
      "slot_id": "EarPair",
      "label": "Replaceable ear pair",
      "category": "body_feature",
      "side": "bilateral",
      "status": "static_tpose_only",
      "attachment": {
        "mode": "rest_surface_pair",
        "rig_dependency": "none_until_rig_intake",
        "anchors": [
          {
            "id": "EarRoot_L",
            "position_h": [
              0.140414,
              0.0,
              0.79
            ],
            "future_parent_bone": "Head",
            "normal": [
              1.0,
              0.0,
              0.0
            ]
          },
          {
            "id": "EarRoot_R",
            "position_h": [
              -0.140802,
              0.0,
              0.79
            ],
            "future_parent_bone": "Head",
            "normal": [
              -1.0,
              0.0,
              0.0
            ]
          }
        ]
      },
      "fit_envelope": {
        "frame": "actor_normalized_rest",
        "kind": "surface",
        "bounds_h": {
          "min": [
            -0.160802,
            -0.16452,
            0.660866
          ],
          "max": [
            0.160414,
            0.16452,
            1.02
          ]
        },
        "clearance_h": 0.008
      },
      "generation_policy": {
        "preferred_mode": "on_actor_then_isolate",
        "allowed_asset_kinds": [
          "human_ear_pair",
          "elf_ear_pair",
          "fantasy_ear_pair"
        ],
        "include_actor_context": true
      },
      "validation": {
        "required_views": 4,
        "required_frames": 1,
        "collision_policy": "project roots to the T-Pose head surface; animation clearance is deferred",
        "human_review_required": true
      },
      "evidence": [
        {
          "path": "milestones/actor_core/chibi3_standard_v1_source_review_20260831/candidates/v9b_balanced/chibi3_v9b_balanced.glb",
          "kind": "measurement",
          "tracked": true,
          "sha256": "74f8787c7b044b9aca86bc9f80f28e1f34c809bb39907b9e26675832e9505e45"
        },
        {
          "path": "milestones/actor_core/chibi3_standard_v1_source_review_20260831/candidates/v9b_balanced/validation/head_roundness_front.json",
          "kind": "fit_report",
          "tracked": true,
          "sha256": "d8ffc6eadef165f24ec1a01be83a2d85c8ee4ae7714539c559388842583e343f"
        }
      ]
    },
    {
      "slot_id": "head_hair",
      "label": "Independent hair shell",
      "category": "hair",
      "side": "center",
      "status": "static_tpose_only",
      "attachment": {
        "mode": "rest_envelope",
        "rig_dependency": "none_until_rig_intake",
        "anchors": [
          {
            "id": "HeadSurfaceCenter",
            "position_h": [
              0.0,
              0.0,
              0.835433
            ],
            "future_parent_bone": "Head"
          }
        ]
      },
      "fit_envelope": {
        "frame": "actor_normalized_rest",
        "kind": "surface",
        "bounds_h": {
          "min": [
            -0.160802,
            -0.16452,
            0.660866
          ],
          "max": [
            0.160414,
            0.16452,
            1.02
          ]
        },
        "clearance_h": 0.008
      },
      "generation_policy": {
        "preferred_mode": "on_actor_then_isolate",
        "allowed_asset_kinds": [
          "hair_cap",
          "bangs",
          "side_locks",
          "back_hair"
        ],
        "include_actor_context": true
      },
      "validation": {
        "required_views": 4,
        "required_frames": 1,
        "collision_policy": "closed crown and static head clearance; neck deformation is deferred",
        "human_review_required": true
      },
      "evidence": [
        {
          "path": "milestones/actor_core/chibi3_standard_v1_source_review_20260831/candidates/v9b_balanced/chibi3_v9b_balanced.glb",
          "kind": "measurement",
          "tracked": true,
          "sha256": "74f8787c7b044b9aca86bc9f80f28e1f34c809bb39907b9e26675832e9505e45"
        },
        {
          "path": "milestones/actor_core/chibi3_standard_v1_source_review_20260831/candidates/v9b_balanced/validation/head_roundness_front.json",
          "kind": "fit_report",
          "tracked": true,
          "sha256": "d8ffc6eadef165f24ec1a01be83a2d85c8ee4ae7714539c559388842583e343f"
        }
      ]
    },
    {
      "slot_id": "headwear",
      "label": "Headwear",
      "category": "headwear",
      "side": "center",
      "status": "static_tpose_only",
      "attachment": {
        "mode": "rest_anchor",
        "rig_dependency": "none_until_rig_intake",
        "anchors": [
          {
            "id": "HeadTop",
            "position_h": [
              0.0,
              0.0,
              1.0
            ],
            "future_parent_bone": "Head",
            "normal": [
              0.0,
              0.0,
              1.0
            ]
          }
        ]
      },
      "fit_envelope": {
        "frame": "actor_normalized_rest",
        "kind": "surface",
        "bounds_h": {
          "min": [
            -0.160802,
            -0.16452,
            0.660866
          ],
          "max": [
            0.160414,
            0.16452,
            1.02
          ]
        },
        "clearance_h": 0.008
      },
      "generation_policy": {
        "preferred_mode": "on_actor_then_isolate",
        "allowed_asset_kinds": [
          "hat",
          "helmet",
          "hood"
        ],
        "include_actor_context": true
      },
      "validation": {
        "required_views": 4,
        "required_frames": 1,
        "collision_policy": "validate static crown, hair and ear envelopes",
        "human_review_required": true
      },
      "evidence": [
        {
          "path": "milestones/actor_core/chibi3_standard_v1_source_review_20260831/candidates/v9b_balanced/chibi3_v9b_balanced.glb",
          "kind": "measurement",
          "tracked": true,
          "sha256": "74f8787c7b044b9aca86bc9f80f28e1f34c809bb39907b9e26675832e9505e45"
        },
        {
          "path": "milestones/actor_core/chibi3_standard_v1_source_review_20260831/candidates/v9b_balanced/validation/head_roundness_front.json",
          "kind": "fit_report",
          "tracked": true,
          "sha256": "d8ffc6eadef165f24ec1a01be83a2d85c8ee4ae7714539c559388842583e343f"
        }
      ]
    },
    {
      "slot_id": "torso_outer",
      "label": "Torso outer layer",
      "category": "wearable",
      "side": "center",
      "status": "static_tpose_only",
      "attachment": {
        "mode": "rest_envelope",
        "rig_dependency": "none_until_rig_intake",
        "anchors": [
          {
            "id": "UpperTorsoCenter",
            "position_h": [
              0.0,
              0.0,
              0.54
            ],
            "future_parent_bone": "Spine2"
          }
        ]
      },
      "fit_envelope": {
        "frame": "actor_normalized_rest",
        "kind": "surface",
        "bounds_h": {
          "min": [
            -0.137568,
            -0.11265,
            0.33
          ],
          "max": [
            0.238624,
            0.100549,
            0.62
          ]
        },
        "clearance_h": 0.008
      },
      "generation_policy": {
        "preferred_mode": "on_actor_then_isolate",
        "allowed_asset_kinds": [
          "jacket",
          "shirt",
          "robe",
          "scarf"
        ],
        "include_actor_context": true
      },
      "validation": {
        "required_views": 4,
        "required_frames": 1,
        "collision_policy": "preserve static neck, axilla and arm clearance",
        "human_review_required": true
      },
      "evidence": [
        {
          "path": "milestones/actor_core/chibi3_standard_v1_source_review_20260831/candidates/v9b_balanced/chibi3_v9b_balanced.glb",
          "kind": "measurement",
          "tracked": true,
          "sha256": "74f8787c7b044b9aca86bc9f80f28e1f34c809bb39907b9e26675832e9505e45"
        },
        {
          "path": "milestones/actor_core/chibi3_standard_v1_source_review_20260831/candidates/v9b_balanced/validation/head_roundness_front.json",
          "kind": "fit_report",
          "tracked": true,
          "sha256": "d8ffc6eadef165f24ec1a01be83a2d85c8ee4ae7714539c559388842583e343f"
        }
      ]
    },
    {
      "slot_id": "waist_accessory",
      "label": "Belt and waist pouch",
      "category": "prop",
      "side": "center",
      "status": "source_contract",